<!ELEMENT motos (moto+)>
<!ELEMENT moto (marca, modelo, anio, color, precio, cilindrada)>
<!ELEMENT marca (#PCDATA)>
<!ELEMENT modelo (#PCDATA)>
<!ELEMENT anio (#PCDATA)>
<!ELEMENT color (#PCDATA)>
<!ELEMENT precio (#PCDATA)>
<!ELEMENT cilindrada (#PCDATA)>